{
  "$id": "file://battmo/schemas/Electrolyser",
  "$schema": "http://json-schema.org/draft-07/schema#",
  "description": "A standard electrolyser",
  "type": "object",
  
  "properties" : {

    "referencePotential" : {
      "$ref": "PhysicalQuantity.schema.json",
      "description" : "Reference potential",
      "symbol" : "Eref"},
    
    "IonomerMembrane": {
      "$ref": "IonomerMembrane"},

    "HydrogenEvolutionElectrode": {
      "$ref": "EvolutionElectrode"},
    
    "OxygenEvolutionElectrode": {
      "$ref": "EvolutionElectrode"}}}
  
